mysql 31165@localhost:(none)> use A08;
You are now connected to database "A08" as user "31165"
Time: 0.001s
mysql 31165@localhost:A08> SELECT * FROM alumni;
╒═══════════╤════════╤═══════════════════╕
│ roll_no   │ name   │ graduation_date   │
╞═══════════╪════════╪═══════════════════╡
╘═══════════╧════════╧═══════════════════╛
0 rows in set
Time: 0.001s
mysql 31165@localhost:A08> SELECT * FROM student;
╒═══════════╤═══════════════╤══════════════════╤══════════╤══════════════╤══════════╕
│ roll_no   │ name          │ admission_date   │ branch   │   percentage │   status │
╞═══════════╪═══════════════╪══════════════════╪══════════╪══════════════╪══════════╡
│ 2k180001  │ Dhiraj Om     │ 2018-05-15       │ CS       │       <null> │   <null> │
├───────────┼───────────────┼──────────────────┼──────────┼──────────────┼──────────┤
│ 2k180002  │ Tanuja Chopra │ 2018-05-16       │ CS       │       <null> │   <null> │
├───────────┼───────────────┼──────────────────┼──────────┼──────────────┼──────────┤
│ 2k180003  │ Naina Johal   │ 2018-05-20       │ ENTC     │       <null> │   <null> │
├───────────┼───────────────┼──────────────────┼──────────┼──────────────┼──────────┤
│ 2k180004  │ Samir Nath    │ 2018-05-25       │ CS       │       <null> │   <null> │
├───────────┼───────────────┼──────────────────┼──────────┼──────────────┼──────────┤
│ 2k180005  │ Hari Nagar    │ 2018-06-05       │ IT       │       <null> │   <null> │
├───────────┼───────────────┼──────────────────┼──────────┼──────────────┼──────────┤
│ 2k180006  │ Diya Kapur    │ 2018-06-08       │ IT       │       <null> │   <null> │
├───────────┼───────────────┼──────────────────┼──────────┼──────────────┼──────────┤
│ 2k180007  │ Rupal Singh   │ 2018-06-18       │ ENTC     │       <null> │   <null> │
├───────────┼───────────────┼──────────────────┼──────────┼──────────────┼──────────┤
│ 2k180008  │ Aruna Reddy   │ 2018-06-23       │ ENTC     │       <null> │   <null> │
├───────────┼───────────────┼──────────────────┼──────────┼──────────────┼──────────┤
│ 2k180009  │ Binod Ram     │ 2018-06-30       │ IT       │       <null> │   <null> │
├───────────┼───────────────┼──────────────────┼──────────┼──────────────┼──────────┤
│ 2k180010  │ Monica Gupta  │ 2018-07-08       │ ENTC     │       <null> │   <null> │
╘═══════════╧═══════════════╧══════════════════╧══════════╧══════════════╧══════════╛
10 rows in set
Time: 0.003s
mysql 31165@localhost:A08> UPDATE student SET percentage='85.9',status='PASS' WHERE roll_no='2k180001';
Query OK, 1 row affected
Time: 0.407s
mysql 31165@localhost:A08> SELECT * FROM student;
╒═══════════╤═══════════════╤══════════════════╤══════════╤══════════════╤══════════╕
│ roll_no   │ name          │ admission_date   │ branch   │   percentage │ status   │
╞═══════════╪═══════════════╪══════════════════╪══════════╪══════════════╪══════════╡
│ 2k180001  │ Dhiraj Om     │ 2018-05-15       │ CS       │         85.9 │ PASS     │
├───────────┼───────────────┼──────────────────┼──────────┼──────────────┼──────────┤
│ 2k180002  │ Tanuja Chopra │ 2018-05-16       │ CS       │     <null>   │ <null>   │
├───────────┼───────────────┼──────────────────┼──────────┼──────────────┼──────────┤
│ 2k180003  │ Naina Johal   │ 2018-05-20       │ ENTC     │     <null>   │ <null>   │
├───────────┼───────────────┼──────────────────┼──────────┼──────────────┼──────────┤
│ 2k180004  │ Samir Nath    │ 2018-05-25       │ CS       │     <null>   │ <null>   │
├───────────┼───────────────┼──────────────────┼──────────┼──────────────┼──────────┤
│ 2k180005  │ Hari Nagar    │ 2018-06-05       │ IT       │     <null>   │ <null>   │
├───────────┼───────────────┼──────────────────┼──────────┼──────────────┼──────────┤
│ 2k180006  │ Diya Kapur    │ 2018-06-08       │ IT       │     <null>   │ <null>   │
├───────────┼───────────────┼──────────────────┼──────────┼──────────────┼──────────┤
│ 2k180007  │ Rupal Singh   │ 2018-06-18       │ ENTC     │     <null>   │ <null>   │
├───────────┼───────────────┼──────────────────┼──────────┼──────────────┼──────────┤
│ 2k180008  │ Aruna Reddy   │ 2018-06-23       │ ENTC     │     <null>   │ <null>   │
├───────────┼───────────────┼──────────────────┼──────────┼──────────────┼──────────┤
│ 2k180009  │ Binod Ram     │ 2018-06-30       │ IT       │     <null>   │ <null>   │
├───────────┼───────────────┼──────────────────┼──────────┼──────────────┼──────────┤
│ 2k180010  │ Monica Gupta  │ 2018-07-08       │ ENTC     │     <null>   │ <null>   │
╘═══════════╧═══════════════╧══════════════════╧══════════╧══════════════╧══════════╛
10 rows in set
Time: 0.003s
mysql 31165@localhost:A08> SELECT * FROM alumni;
╒═══════════╤═══════════╤═══════════════════╕
│ roll_no   │ name      │ graduation_date   │
╞═══════════╪═══════════╪═══════════════════╡
│ 2k180001  │ Dhiraj Om │ 2020-10-07        │
╘═══════════╧═══════════╧═══════════════════╛
1 row in set
Time: 0.002s
mysql 31165@localhost:A08> UPDATE student SET percentage='85.9',status='DROP' WHERE roll_no='2k180001';
Query OK, 1 row affected
Time: 1.117s
mysql 31165@localhost:A08> SELECT * FROM alumni;
╒═══════════╤════════╤═══════════════════╕
│ roll_no   │ name   │ graduation_date   │
╞═══════════╪════════╪═══════════════════╡
╘═══════════╧════════╧═══════════════════╛
0 rows in set
Time: 0.001s
mysql 31165@localhost:A08> UPDATE student SET status = 'PASS';
Query OK, 10 rows affected
Time: 1.380s
mysql 31165@localhost:A08> DELETE FROM alumni;
Query OK, 10 rows affected
Time: 0.558s
mysql 31165@localhost:A08> DELETE FROM student;
Query OK, 10 rows affected
Time: 0.506s
mysql 31165@localhost:A08> SELECT * FROM alumni;
╒═══════════╤═══════════════╤═══════════════════╕
│ roll_no   │ name          │ graduation_date   │
╞═══════════╪═══════════════╪═══════════════════╡
│ 2k180001  │ Dhiraj Om     │ 2020-10-07        │
├───────────┼───────────────┼───────────────────┤
│ 2k180002  │ Tanuja Chopra │ 2020-10-07        │
├───────────┼───────────────┼───────────────────┤
│ 2k180003  │ Naina Johal   │ 2020-10-07        │
├───────────┼───────────────┼───────────────────┤
│ 2k180004  │ Samir Nath    │ 2020-10-07        │
├───────────┼───────────────┼───────────────────┤
│ 2k180005  │ Hari Nagar    │ 2020-10-07        │
├───────────┼───────────────┼───────────────────┤
│ 2k180006  │ Diya Kapur    │ 2020-10-07        │
├───────────┼───────────────┼───────────────────┤
│ 2k180007  │ Rupal Singh   │ 2020-10-07        │
├───────────┼───────────────┼───────────────────┤
│ 2k180008  │ Aruna Reddy   │ 2020-10-07        │
├───────────┼───────────────┼───────────────────┤
│ 2k180009  │ Binod Ram     │ 2020-10-07        │
├───────────┼───────────────┼───────────────────┤
│ 2k180010  │ Monica Gupta  │ 2020-10-07        │
╘═══════════╧═══════════════╧═══════════════════╛
10 rows in set
Time: 0.002s

-----------------------------------------------------------------------------------------------------------------

mysql 31165@localhost:A08> SELECT * FROM customer;
╒═══════════════╤═══════════════════╤════════════╤═══════════════════╤══════════╕
│   customer_id │ name              │ deadline   │ scheme            │ status   │
╞═══════════════╪═══════════════════╪════════════╪═══════════════════╪══════════╡
│             1 │ Jagdish Koshy     │ 2020-08-06 │ fixed_deposit     │ N        │
├───────────────┼───────────────────┼────────────┼───────────────────┼──────────┤
│             2 │ Koushtubh Sood    │ 2020-09-01 │ recurring_deposit │ N        │
├───────────────┼───────────────────┼────────────┼───────────────────┼──────────┤
│             3 │ Sapna Lad         │ 2020-08-22 │ platinum          │ N        │
├───────────────┼───────────────────┼────────────┼───────────────────┼──────────┤
│             4 │ Hema Puri         │ 2020-07-19 │ currunent_deposit │ N        │
├───────────────┼───────────────────┼────────────┼───────────────────┼──────────┤
│             5 │ Kushal Solanki    │ 2020-08-28 │ basic_deposit     │ N        │
├───────────────┼───────────────────┼────────────┼───────────────────┼──────────┤
│             6 │ Rita Inani        │ 2020-08-15 │ basic_deposit     │ N        │
├───────────────┼───────────────────┼────────────┼───────────────────┼──────────┤
│             7 │ Tanay Parikh      │ 2020-07-12 │ platinum          │ N        │
├───────────────┼───────────────────┼────────────┼───────────────────┼──────────┤
│             8 │ Bhanupriya Dhawan │ 2020-08-10 │ recurring_deposit │ N        │
├───────────────┼───────────────────┼────────────┼───────────────────┼──────────┤
│             9 │ Himani Sachar     │ 2020-09-01 │ basic_deposit     │ N        │
├───────────────┼───────────────────┼────────────┼───────────────────┼──────────┤
│            10 │ Anusha Srinivasan │ 2020-08-22 │ currunent_deposit │ N        │
├───────────────┼───────────────────┼────────────┼───────────────────┼──────────┤
│            11 │ Anil Badal        │ 2020-08-02 │ fixed_deposit     │ N        │
├───────────────┼───────────────────┼────────────┼───────────────────┼──────────┤
│            12 │ Charu Dodiya      │ 2020-07-30 │ recurring_deposit │ N        │
├───────────────┼───────────────────┼────────────┼───────────────────┼──────────┤
│            13 │ Tulsi Mathew      │ 2020-08-20 │ recurring_deposit │ N        │
├───────────────┼───────────────────┼────────────┼───────────────────┼──────────┤
│            14 │ Kailash Sengupta  │ 2020-08-04 │ basic_deposit     │ N        │
╘═══════════════╧═══════════════════╧════════════╧═══════════════════╧══════════╛
14 rows in set
Time: 0.004s
mysql 31165@localhost:A08> SELECT * FROM fine;
╒═══════════════╤════════════════╤══════════╕
│ customer_id   │ payment_date   │ amount   │
╞═══════════════╪════════════════╪══════════╡
╘═══════════════╧════════════════╧══════════╛
0 rows in set
Time: 0.001s
mysql 31165@localhost:A08> UPDATE customer SET status='P' WHERE customer_id=2;
Query OK, 1 row affected
Time: 0.171s
mysql 31165@localhost:A08> SELECT * FROM fine;
╒═══════════════╤════════════════╤══════════╕
│   customer_id │ payment_date   │   amount │
╞═══════════════╪════════════════╪══════════╡
│             2 │ 2020-10-07     │      375 │
╘═══════════════╧════════════════╧══════════╛
1 row in set
Time: 0.001s
mysql 31165@localhost:A08> SELECT * FROM customer;
╒═══════════════╤═══════════════════╤════════════╤═══════════════════╤══════════╕
│   customer_id │ name              │ deadline   │ scheme            │ status   │
╞═══════════════╪═══════════════════╪════════════╪═══════════════════╪══════════╡
│             1 │ Jagdish Koshy     │ 2020-08-06 │ fixed_deposit     │ N        │
├───────────────┼───────────────────┼────────────┼───────────────────┼──────────┤
│             2 │ Koushtubh Sood    │ 2020-09-01 │ recurring_deposit │ P        │
├───────────────┼───────────────────┼────────────┼───────────────────┼──────────┤
│             3 │ Sapna Lad         │ 2020-08-22 │ platinum          │ N        │
├───────────────┼───────────────────┼────────────┼───────────────────┼──────────┤
│             4 │ Hema Puri         │ 2020-07-19 │ currunent_deposit │ N        │
├───────────────┼───────────────────┼────────────┼───────────────────┼──────────┤
│             5 │ Kushal Solanki    │ 2020-08-28 │ basic_deposit     │ N        │
├───────────────┼───────────────────┼────────────┼───────────────────┼──────────┤
│             6 │ Rita Inani        │ 2020-08-15 │ basic_deposit     │ N        │
├───────────────┼───────────────────┼────────────┼───────────────────┼──────────┤
│             7 │ Tanay Parikh      │ 2020-07-12 │ platinum          │ N        │
├───────────────┼───────────────────┼────────────┼───────────────────┼──────────┤
│             8 │ Bhanupriya Dhawan │ 2020-08-10 │ recurring_deposit │ N        │
├───────────────┼───────────────────┼────────────┼───────────────────┼──────────┤
│             9 │ Himani Sachar     │ 2020-09-01 │ basic_deposit     │ N        │
├───────────────┼───────────────────┼────────────┼───────────────────┼──────────┤
│            10 │ Anusha Srinivasan │ 2020-08-22 │ currunent_deposit │ N        │
├───────────────┼───────────────────┼────────────┼───────────────────┼──────────┤
│            11 │ Anil Badal        │ 2020-08-02 │ fixed_deposit     │ N        │
├───────────────┼───────────────────┼────────────┼───────────────────┼──────────┤
│            12 │ Charu Dodiya      │ 2020-07-30 │ recurring_deposit │ N        │
├───────────────┼───────────────────┼────────────┼───────────────────┼──────────┤
│            13 │ Tulsi Mathew      │ 2020-08-20 │ recurring_deposit │ N        │
├───────────────┼───────────────────┼────────────┼───────────────────┼──────────┤
│            14 │ Kailash Sengupta  │ 2020-08-04 │ basic_deposit     │ N        │
╘═══════════════╧═══════════════════╧════════════╧═══════════════════╧══════════╛
14 rows in set
Time: 0.003s
mysql 31165@localhost:A08> 



