mysql 31165@localhost:(none)> use A02;
You are now connected to database "A02" as user "31165"
Time: 0.004s
mysql 31165@localhost:A02> # 02. Display all customer details with city pune and mumbai and customer first name starting with 'p' or 'h'.
                        -> SELECT * FROM customer 
                        -> WHERE 
                        -> city='Mumbai'
                        -> or
                        -> city='Pune '
                        -> or
                        -> cust_fname like 'P%'
                        -> or
                        -> cust_fname like 'H%';
╒═══════════╤══════════════╤══════════════╤════════════════╤═════════════╤════════╤══════════════╕
│   cust_no │ cust_fname   │ cust_lname   │ cust_company   │ cust_addr   │ city   │   cust_phone │
╞═══════════╪══════════════╪══════════════╪════════════════╪═════════════╪════════╪══════════════╡
│         1 │ Aruna        │ Gupte        │ Wipro          │ Colaba      │ Mumbai │   4859448542 │
├───────────┼──────────────┼──────────────┼────────────────┼─────────────┼────────┼──────────────┤
│         2 │ Indra        │ Trivedi      │ <null>         │ Chembur     │ Mumbai │   6556148588 │
├───────────┼──────────────┼──────────────┼────────────────┼─────────────┼────────┼──────────────┤
│         4 │ Dharma       │ Brar         │ Rolta          │ Achole      │ Mumbai │   4154351120 │
├───────────┼──────────────┼──────────────┼────────────────┼─────────────┼────────┼──────────────┤
│         5 │ Hema         │ Gothe        │ <null>         │ Katraj      │ Pune   │   7896548569 │
├───────────┼──────────────┼──────────────┼────────────────┼─────────────┼────────┼──────────────┤
│         7 │ Bharat       │ Raj          │ <null>         │ LBS Marg    │ Mumbai │   9425244745 │
├───────────┼──────────────┼──────────────┼────────────────┼─────────────┼────────┼──────────────┤
│         9 │ Mhahden      │ Loke         │ <null>         │ APMC        │ Mumbai │   8304051199 │
╘═══════════╧══════════════╧══════════════╧════════════════╧═════════════╧════════╧══════════════╛
6 rows in set
Time: 0.003s
mysql 31165@localhost:A02> # 03. lists the number of different customer cities.
                        -> SELECT DISTINCT city FROM customer;
╒═══════════╕
│ city      │
╞═══════════╡
│ Mumbai    │
├───────────┤
│ Bangalore │
├───────────┤
│ Pune      │
├───────────┤
│ Ahmedabad │
├───────────┤
│ Hyderabad │
├───────────┤
│ Delhi     │
╘═══════════╛
6 rows in set
Time: 0.001s
mysql 31165@localhost:A02> # 04. Give 5% increase in price of the books with publishing year 2019.^I 
                        -> UPDATE book SET
                        -> unit_price = unit_price*1.05
                        -> WHERE pub_year=2019;
Query OK, 2 rows affected
Time: 0.771s
mysql 31165@localhost:A02> SELECT * FROM book;
╒═══════════════╤═════════════════════════════════╤══════════════╤═════════════╤════════════════╤════════════╕
│          ISBN │ title                           │   unit_price │   author_no │   publisher_no │   pub_year │
╞═══════════════╪═════════════════════════════════╪══════════════╪═════════════╪════════════════╪════════════╡
│    0132856204 │ Computer Networking             │          470 │           9 │              3 │       2020 │
├───────────────┼─────────────────────────────────┼──────────────┼─────────────┼────────────────┼────────────┤
│    0139137084 │ Theory of Finite Automata       │          350 │           4 │              6 │       2017 │
├───────────────┼─────────────────────────────────┼──────────────┼─────────────┼────────────────┼────────────┤
│    8176569925 │ Wireless Networks               │          420 │           7 │              5 │       2020 │
├───────────────┼─────────────────────────────────┼──────────────┼─────────────┼────────────────┼────────────┤
│ 9780521424264 │ Computational Complexity        │          490 │           2 │              2 │       2019 │
├───────────────┼─────────────────────────────────┼──────────────┼─────────────┼────────────────┼────────────┤
│ 9781259005589 │ The Theory of Computation       │          345 │           1 │              1 │       2020 │
├───────────────┼─────────────────────────────────┼──────────────┼─────────────┼────────────────┼────────────┤
│ 9781449344689 │ MongoDB: The Definitive Guide   │          320 │           5 │              6 │       2019 │
├───────────────┼─────────────────────────────────┼──────────────┼─────────────┼────────────────┼────────────┤
│ 9788120348981 │ Fundamentals of Development     │          380 │          10 │              6 │       2017 │
├───────────────┼─────────────────────────────────┼──────────────┼─────────────┼────────────────┼────────────┤
│ 9788126513345 │ Introduction to Computer Theory │          520 │           3 │              4 │       2017 │
├───────────────┼─────────────────────────────────┼──────────────┼─────────────┼────────────────┼────────────┤
│ 9788131706886 │ Ad Hoc Wireless Networks        │          375 │           8 │              6 │       2018 │
├───────────────┼─────────────────────────────────┼──────────────┼─────────────┼────────────────┼────────────┤
│ 9789351109341 │ Using Sqlite                    │          340 │           6 │              5 │       2018 │
╘═══════════════╧═════════════════════════════════╧══════════════╧═════════════╧════════════════╧════════════╛
10 rows in set
Time: 0.008s
mysql 31165@localhost:A02> # 05. Delete customer details living in pune.
                        -> DELETE FROM customer WHERE city = 'Pune';
You're about to run a destructive command.
Do you want to proceed? (y/n): y
Your call!
Query OK, 1 row affected
Time: 0.217s
mysql 31165@localhost:A02> # 06. Find the names of authors living in India or Australia .
                        -> select author_name from author WHERE country='India' 
                        -> union
                        -> select author_name from author WHERE country='Australia';
╒═════════════════╕
│ author_name     │
╞═════════════════╡
│ Sanjeev Arora   │
├─────────────────┤
│ Siva Ram Murthy │
├─────────────────┤
│ Rajib Mall      │
╘═════════════════╛
3 rows in set
Time: 0.005s
mysql 31165@localhost:A02> # 07. Find the publishers who are established in year 2015 as well as in 2016
                        -> select * from publisher 
                        -> WHERE year=2015 and year=2016;
╒════════════════╤══════════════════╤══════════════════╤════════╕
│ publisher_no   │ publisher_name   │ publisher_addr   │ year   │
╞════════════════╪══════════════════╪══════════════════╪════════╡
│              3 │ Pearson          │ London,UK        │   1844 │
╘════════════════╧══════════════════╧══════════════════╧════════╛
0 rows in set
Time: 0.005s
mysql 31165@localhost:A02> # 08(i). Find the book having maximum price
                        -> SELECT * from book ORDER BY unit_price DESC LIMIT 1;
╒═══════════════╤═════════════════════════════════╤══════════════╤═════════════╤════════════════╤════════════╕
│          ISBN │ title                           │   unit_price │   author_no │   publisher_no │   pub_year │
╞═══════════════╪═════════════════════════════════╪══════════════╪═════════════╪════════════════╪════════════╡
│ 9788126513345 │ Introduction to Computer Theory │          520 │           3 │              4 │       2017 │
╘═══════════════╧═════════════════════════════════╧══════════════╧═════════════╧════════════════╧════════════╛
1 row in set
Time: 0.002s
mysql 31165@localhost:A02> # 08(ii). Find titles of book having price between 300 and 400.
                        -> select * from book 
                        -> WHERE unit_price between 300 and 400;
╒═══════════════╤═══════════════════════════════╤══════════════╤═════════════╤════════════════╤════════════╕
│          ISBN │ title                         │   unit_price │   author_no │   publisher_no │   pub_year │
╞═══════════════╪═══════════════════════════════╪══════════════╪═════════════╪════════════════╪════════════╡
│    0139137084 │ Theory of Finite Automata     │          350 │           4 │              6 │       2017 │
├───────────────┼───────────────────────────────┼──────────────┼─────────────┼────────────────┼────────────┤
│ 9781259005589 │ The Theory of Computation     │          345 │           1 │              1 │       2020 │
├───────────────┼───────────────────────────────┼──────────────┼─────────────┼────────────────┼────────────┤
│ 9781449344689 │ MongoDB: The Definitive Guide │          320 │           5 │              6 │       2019 │
├───────────────┼───────────────────────────────┼──────────────┼─────────────┼────────────────┼────────────┤
│ 9788120348981 │ Fundamentals of Development   │          380 │          10 │              6 │       2017 │
├───────────────┼───────────────────────────────┼──────────────┼─────────────┼────────────────┼────────────┤
│ 9788131706886 │ Ad Hoc Wireless Networks      │          375 │           8 │              6 │       2018 │
├───────────────┼───────────────────────────────┼──────────────┼─────────────┼────────────────┼────────────┤
│ 9789351109341 │ Using Sqlite                  │          340 │           6 │              5 │       2018 │
╘═══════════════╧═══════════════════════════════╧══════════════╧═════════════╧════════════════╧════════════╛
6 rows in set
Time: 0.007s
mysql 31165@localhost:A02> # 09. Display all titles of books with price and published year in decreasing order of publishing year.^I
                        -> SELECT * from book
                        -> ORDER BY pub_year desc;
╒═══════════════╤═════════════════════════════════╤══════════════╤═════════════╤════════════════╤════════════╕
│          ISBN │ title                           │   unit_price │   author_no │   publisher_no │   pub_year │
╞═══════════════╪═════════════════════════════════╪══════════════╪═════════════╪════════════════╪════════════╡
│    0132856204 │ Computer Networking             │          470 │           9 │              3 │       2020 │
├───────────────┼─────────────────────────────────┼──────────────┼─────────────┼────────────────┼────────────┤
│    8176569925 │ Wireless Networks               │          420 │           7 │              5 │       2020 │
├───────────────┼─────────────────────────────────┼──────────────┼─────────────┼────────────────┼────────────┤
│ 9781259005589 │ The Theory of Computation       │          345 │           1 │              1 │       2020 │
├───────────────┼─────────────────────────────────┼──────────────┼─────────────┼────────────────┼────────────┤
│ 9780521424264 │ Computational Complexity        │          490 │           2 │              2 │       2019 │
├───────────────┼─────────────────────────────────┼──────────────┼─────────────┼────────────────┼────────────┤
│ 9781449344689 │ MongoDB: The Definitive Guide   │          320 │           5 │              6 │       2019 │
├───────────────┼─────────────────────────────────┼──────────────┼─────────────┼────────────────┼────────────┤
│ 9788131706886 │ Ad Hoc Wireless Networks        │          375 │           8 │              6 │       2018 │
├───────────────┼─────────────────────────────────┼──────────────┼─────────────┼────────────────┼────────────┤
│ 9789351109341 │ Using Sqlite                    │          340 │           6 │              5 │       2018 │
├───────────────┼─────────────────────────────────┼──────────────┼─────────────┼────────────────┼────────────┤
│    0139137084 │ Theory of Finite Automata       │          350 │           4 │              6 │       2017 │
├───────────────┼─────────────────────────────────┼──────────────┼─────────────┼────────────────┼────────────┤
│ 9788120348981 │ Fundamentals of Development     │          380 │          10 │              6 │       2017 │
├───────────────┼─────────────────────────────────┼──────────────┼─────────────┼────────────────┼────────────┤
│ 9788126513345 │ Introduction to Computer Theory │          520 │           3 │              4 │       2017 │
╘═══════════════╧═════════════════════════════════╧══════════════╧═════════════╧════════════════╧════════════╛
10 rows in set
Time: 0.004s
mysql 31165@localhost:A02> # 10. Display title,author_no and publisher_no of all books published in 2000,2004,2006.
                        -> select author_no,publisher_no FROM book 
                        -> where pub_year in (2000,2004,2018);
╒═════════════╤════════════════╕
│   author_no │   publisher_no │
╞═════════════╪════════════════╡
│           8 │              6 │
├─────────────┼────────────────┤
│           6 │              5 │
╘═════════════╧════════════════╛
2 rows in set
Time: 0.002s
mysql 31165@localhost:A02> exit

